team1_name,team2_name,map_number,champs1_names,champs2_names,win,match_day,first_blood,kills_5
Albus NoX Luna,Vega Squadron,1,"Poppy, Elise, Anivia, Brand, Sivir","Maokai, Kindred, Karma, Caitlyn, Bard",100,2016-06-19,100,
Tornado Rox,Natus Vincere,1,"Swain, Graves, Azir, Ezreal, Braum","Maokai, Olaf, Viktor, Sivir, Karma",100,2016-06-19,200,
Gamibt,Team Just,1,"Maokai, Hecarim, Viktor, Kalista, Brand","Trundle, Graves, Taliyah, Sivir, Zyra",100,2016-06-19,100,
Team Empire,Vaevictis eSports,1,"Irelia, Rek'Sai, Syndra, Tristana, Karma","Trundle, Gragas, Viktor, Ezreal, Bard",200,2016-06-19,200,
Empire,Tornado Rox,1,"Maokai, Hecarim, LeBlanc, Sivir, Karma","Gnar, Kindred, Ryze, Lucian, Nami",200,2016-06-26,200,
Vaevictis eSports,Team Just,1,"Trundle, Ryze, Gragas, Lucian, Bard","Gnar, Rek'Sai, Caitlyn, Nami, Taliyah",200,2016-06-26,200,
Vega Squadron,Natus Vincere,1,"Shen, Hecarim, Viktor, Lucian, Bard","Trundle, Gragas, Anivia, Sivir, Brand",200,2016-06-26,100,
Albus NoX Luna,Gambit,1,"Trundle, Elise, Braum, Sivir, Ryze","Shen, Lulu, Karma, Lee Sin, Kog'Maw",200,2016-06-26,100,
